<?xml version="1.0" encoding="UTF-8"?>
<xs:schema xmlns="http://tempuri.org/circuito" elementFormDefault="qualified" targetNamespace="http://tempuri.org/circuito" xmlns:xs="http://www.w3.org/2001/XMLSchema">
	<xs:element name="circuito">
		<xs:complexType>
			<xs:sequence>
				<xs:element ref="nombre" />
				<xs:element ref="longitud" />
				<xs:element ref="anchura_media" />
				<xs:element ref="fecha" />
				<xs:element ref="hora_inicio" />
				<xs:element ref="numero_vueltas" />
				<xs:element ref="localidad" />
				<xs:element ref="pais" />
				<xs:element ref="referencias" />
				<xs:element ref="galeria" />
				<xs:element ref="galeria_videos" />
				<xs:element ref="coordenadas" />
				<xs:element ref="tramos" />
			</xs:sequence>
		</xs:complexType>
	</xs:element>
	<xs:element name="nombre" type="xs:string" />
	<xs:element name="longitud">
		<xs:complexType>
			<xs:simpleContent>
				<xs:extension base="xs:float">
					<xs:attribute name="unidad" type="xs:string" use="required" />
				</xs:extension>
			</xs:simpleContent>
		</xs:complexType>
	</xs:element>
	<xs:element name="anchura_media" type="xs:integer" />
	<xs:element name="fecha" type="xs:date" />
	<xs:element name="hora_inicio" type="xs:time" />
	<xs:element name="numero_vueltas" type="xs:integer" />
	<xs:element name="localidad" type="xs:string" />
	<xs:element name="pais" type="xs:string" />
	<xs:element name="referencias">
		<xs:complexType>
			<xs:sequence>
				<xs:element minOccurs="3" maxOccurs="unbounded" ref="referencia" />
			</xs:sequence>
		</xs:complexType>
	</xs:element>
	<xs:element name="referencia" type="xs:string" />
	<xs:element name="galeria">
		<xs:complexType>
			<xs:sequence>
				<xs:element minOccurs="1" maxOccurs="5" ref="fotografia" />
			</xs:sequence>
		</xs:complexType>
	</xs:element>
	<xs:element name="fotografia" type="xs:string" />
	<xs:element name="galeria_videos">
		<xs:complexType>
			<xs:sequence>
				<xs:element minOccurs="0" maxOccurs="3" ref="video" />
			</xs:sequence>
		</xs:complexType>
	</xs:element>
	<xs:element name="video" type="xs:string" />
	<xs:element name="coordenadas">
		<xs:complexType>
			<xs:sequence>
				<xs:element ref="coordenada" />
			</xs:sequence>
		</xs:complexType>
	</xs:element>
	<xs:element name="coordenada">
		<xs:complexType>
			<xs:sequence>
				<xs:element ref="longitudCoor" />
				<xs:element ref="latitud" />
				<xs:element ref="altitud" />
			</xs:sequence>
		</xs:complexType>
	</xs:element>
	<xs:element name="longitudCoor" type="xs:float" />
	<xs:element name="latitud" type="xs:float" />
	<xs:element name="altitud" type="xs:float" />
	<xs:element name="tramos">
		<xs:complexType>
			<xs:sequence>
				<xs:element minOccurs="1" maxOccurs="unbounded" ref="tramo" />
			</xs:sequence>
		</xs:complexType>
	</xs:element>
	<xs:element name="tramo">
		<xs:complexType>
			<xs:sequence>
				<xs:element ref="coordenadas_finales" />
			</xs:sequence>
		</xs:complexType>
	</xs:element>
	<xs:element name="coordenadas_finales">
		<xs:complexType>
			<xs:sequence>
				<xs:element ref="distancia" />
				<xs:element ref="longitudCoor" />
				<xs:element ref="latitud" />
				<xs:element ref="altitud" />
				<xs:element ref="sector" />
			</xs:sequence>
		</xs:complexType>
	</xs:element>
	<xs:element name="distancia">
		<xs:complexType>
			<xs:simpleContent>
				<xs:extension base="xs:float">
					<xs:attribute name="unidad" type="xs:string" use="required" />
				</xs:extension>
			</xs:simpleContent>
		</xs:complexType>
	</xs:element>
	<xs:element name="sector" type="xs:integer" />
</xs:schema>